{
  "version": "aid-document/v1",
  "aid": "eip155:11155111:0x65ab82feC38c3A5F2A5b0bd96cB3255E7A45ae42",
  "did": "did:aid:eip155:11155111:0x65ab82feC38c3A5F2A5b0bd96cB3255E7A45ae42",
  "binding": {
    "registry": "0x8004A818BFB912233c491871b3d84c89A494BD9e",
    "agentId": 10387
  },
  "alsoKnownAs": [
    "eip155:8453:0x65ab82feC38c3A5F2A5b0bd96cB3255E7A45ae42"
  ],
  "livenessWindow": 7776000,
  "updatedAt": 1790000000,
  "facets": [
    {
      "facetType": "aid:core/identity/v1",
      "provenance": "SELF",
      "issuer": "eip155:11155111:0x65ab82feC38c3A5F2A5b0bd96cB3255E7A45ae42",
      "validFrom": 1790000000,
      "validUntil": 1821536000,
      "observedAt": 1790000000,
      "digest": "0x35bc285bf8de917be9a06a6047889851d855bfe727f6fb378badf6fba4b63fd2",
      "access": {
        "mode": "PUBLIC"
      },
      "resolver": {
        "kind": "erc8004-identity",
        "chainId": 11155111,
        "registry": "0x8004A818BFB912233c491871b3d84c89A494BD9e",
        "agentId": 10387
      }
    },
    {
      "facetType": "aid:core/kya/v1",
      "provenance": "ATTESTED",
      "issuer": "eip155:11155111:0x1111111111111111111111111111111111111111",
      "validUntil": 1805536000,
      "observedAt": 1790000000,
      "digest": "0x6f432dee3088757928673636226127db21c4e1c7c5f5e8c4ff54b321a9769a54",
      "access": {
        "mode": "PUBLIC"
      },
      "resolver": {
        "kind": "erc8419-assertion",
        "chainId": 11155111,
        "registry": "0xBFCC1ABc83a0caC5E76348738c551BfAae0a09f5",
        "schemeId": "0xc3d44c830a5c118f980f48317b97e9eaa920a7bbd204c7d3595ac191d4726764",
        "issuers": [
          "0x1111111111111111111111111111111111111111"
        ]
      }
    },
    {
      "facetType": "aid:finance/observed/v1",
      "provenance": "PROVED",
      "issuer": "eip155:11155111:0x1111111111111111111111111111111111111111",
      "validFrom": 1790000000,
      "validUntil": 1797776000,
      "observedAt": 1790000000,
      "digest": "0x7c4ad6ec8569c8ecc588a6fb33e96993e650f3982f10faaaef5cd13743a656c5",
      "access": {
        "mode": "ZK",
        "verifier": "0x540B7651FA94Cd586599Deb478893D800bc3C2d8",
        "predicates": [
          "leverageMax_lt",
          "counterpartyDispersion_gte"
        ]
      },
      "resolver": {
        "kind": "erc8419-assertion",
        "chainId": 11155111,
        "registry": "0xBFCC1ABc83a0caC5E76348738c551BfAae0a09f5",
        "schemeId": "0x15a5daff4db486768100578d213539b9dbcf350805f60cdc943021eb22801353",
        "issuers": [
          "0x1111111111111111111111111111111111111111"
        ]
      }
    },
    {
      "facetType": "aid:skills/erc8338/v1",
      "provenance": "OBSERVED",
      "issuer": "eip155:11155111:0x65ab82feC38c3A5F2A5b0bd96cB3255E7A45ae42",
      "validUntil": 1792592000,
      "observedAt": 1790000000,
      "digest": "0x9e722b732b1c381c00b105f5be82d19c2d2fb8f33a7faf51fd5b36b6e2077cd6",
      "access": {
        "mode": "PUBLIC"
      },
      "uri": "ipfs://bafy.../skills.json",
      "resolver": {
        "kind": "erc8338",
        "chainId": 11155111,
        "contracts": [
          "0x2222222222222222222222222222222222222222"
        ],
        "roles": [
          "creator",
          "owner",
          "executor",
          "genesisCreator"
        ]
      }
    },
    {
      "facetType": "aid:tasks/erc8414/v1",
      "provenance": "OBSERVED",
      "issuer": "eip155:11155111:0x65ab82feC38c3A5F2A5b0bd96cB3255E7A45ae42",
      "validUntil": 1792592000,
      "observedAt": 1790000000,
      "digest": "0x5f957f48696553707306f8780eac17fdd5f273de88b98330ae75eed5be0899df",
      "access": {
        "mode": "PUBLIC"
      },
      "uri": "ipfs://bafy.../tasks.json",
      "resolver": {
        "kind": "erc8414",
        "chainId": 11155111,
        "contracts": [
          "0xA62059A498E40C4Ae4aF926E2B00C1Ff122bDdb7"
        ],
        "roles": [
          "creator",
          "funder",
          "bidder",
          "fulfiller",
          "judge"
        ]
      }
    },
    {
      "facetType": "aid:review/erc8004/v1",
      "provenance": "ATTESTED",
      "issuer": "eip155:11155111:0x65ab82feC38c3A5F2A5b0bd96cB3255E7A45ae42",
      "validUntil": 1792592000,
      "observedAt": 1790000000,
      "digest": "0x3a089834109e7ce6bbea26214c6e69225c6e7557de17e04481e7bec22146c186",
      "access": {
        "mode": "PUBLIC"
      },
      "resolver": {
        "kind": "erc8004-reputation",
        "chainId": 11155111,
        "registry": "0x0000000000000000000000000000000000008004",
        "agentId": 10387,
        "tag1": "*"
      }
    }
  ]
}